{
  "formato": "mecanifica.catalogo-capacidades@1",
  "assinatura": "sha256:8a1ee64860409b98c49effe8c68260b27be81a62bf281038e6a5f3c31d85f028",
  "modulos": [
    {
      "id": "mecanifica.motor.nucleo",
      "versao": "1.0.0",
      "requer": [],
      "operacoes": [
        {
          "id": "mecanifica.operacao.apagaFace",
          "nome": "apagaFace",
          "versao": "1.0.0",
          "categoria": "procedural",
          "artefatos": {
            "entra": [
              "mecanifica.malha-poligonal@1"
            ],
            "sai": [
              "mecanifica.malha-poligonal@1"
            ]
          },
          "interfaces": {
            "entra": [],
            "sai": []
          },
          "requisitos": [],
          "custo": 1,
          "efeitos": [
            "transforma-malha"
          ],
          "identidade": "preserva-ou-deriva",
          "uso": {
            "intencao": "Remover exatamente uma face, preferencialmente por seleção semântica.",
            "schema": "mecanifica.argumentos.apagaFace@1",
            "obrigatorios": []
          }
        },
        {
          "id": "mecanifica.operacao.arranja",
          "nome": "arranja",
          "versao": "1.0.0",
          "categoria": "procedural",
          "artefatos": {
            "entra": [
              "mecanifica.malha-poligonal@1"
            ],
            "sai": [
              "mecanifica.malha-poligonal@1"
            ]
          },
          "interfaces": {
            "entra": [],
            "sai": []
          },
          "requisitos": [],
          "custo": 1,
          "efeitos": [
            "transforma-malha"
          ],
          "identidade": "preserva-ou-deriva",
          "uso": {
            "intencao": "Criar cópias lineares ou radiais com identidade estrutural.",
            "schema": "mecanifica.argumentos.arranja@1",
            "obrigatorios": [
              "modo",
              "total"
            ]
          }
        },
        {
          "id": "mecanifica.operacao.arredondarAresta",
          "nome": "arredondarAresta",
          "versao": "1.0.0",
          "categoria": "procedural",
          "artefatos": {
            "entra": [
              "mecanifica.malha-poligonal@1"
            ],
            "sai": [
              "mecanifica.malha-poligonal@1"
            ]
          },
          "interfaces": {
            "entra": [],
            "sai": []
          },
          "requisitos": [],
          "custo": 1,
          "efeitos": [
            "transforma-malha"
          ],
          "identidade": "preserva-ou-deriva",
          "uso": {
            "intencao": "Substituir uma aresta convexa por múltiplos painéis de raio geométrico.",
            "schema": "mecanifica.argumentos.arredondarAresta@1",
            "obrigatorios": [
              "origemId",
              "de",
              "aresta",
              "raio",
              "paineis"
            ]
          }
        },
        {
          "id": "mecanifica.operacao.chamferBox",
          "nome": "chamferBox",
          "versao": "1.0.0",
          "categoria": "procedural",
          "artefatos": {
            "entra": [],
            "sai": [
              "mecanifica.malha-poligonal@1"
            ]
          },
          "interfaces": {
            "entra": [],
            "sai": []
          },
          "requisitos": [],
          "custo": 1,
          "efeitos": [
            "cria-geometria"
          ],
          "identidade": "cria-por-passo",
          "uso": {
            "intencao": "Criar caixa de faces planas com quinas chanfradas.",
            "schema": "mecanifica.argumentos.chamferBox@1",
            "obrigatorios": []
          }
        },
        {
          "id": "mecanifica.operacao.cilindro",
          "nome": "cilindro",
          "versao": "1.0.0",
          "categoria": "procedural",
          "artefatos": {
            "entra": [],
            "sai": [
              "mecanifica.malha-poligonal@1"
            ]
          },
          "interfaces": {
            "entra": [],
            "sai": []
          },
          "requisitos": [],
          "custo": 1,
          "efeitos": [
            "cria-geometria"
          ],
          "identidade": "cria-por-passo",
          "uso": {
            "intencao": "Criar cilindro fechado com laterais e duas tampas endereçáveis.",
            "schema": "mecanifica.argumentos.cilindro@1",
            "obrigatorios": []
          }
        },
        {
          "id": "mecanifica.operacao.cone",
          "nome": "cone",
          "versao": "1.0.0",
          "categoria": "procedural",
          "artefatos": {
            "entra": [],
            "sai": [
              "mecanifica.malha-poligonal@1"
            ]
          },
          "interfaces": {
            "entra": [],
            "sai": []
          },
          "requisitos": [],
          "custo": 1,
          "efeitos": [
            "cria-geometria"
          ],
          "identidade": "cria-por-passo",
          "uso": {
            "intencao": "Criar cone fechado com base circular.",
            "schema": "mecanifica.argumentos.cone@1",
            "obrigatorios": []
          }
        },
        {
          "id": "mecanifica.operacao.cubo",
          "nome": "cubo",
          "versao": "1.0.0",
          "categoria": "procedural",
          "artefatos": {
            "entra": [],
            "sai": [
              "mecanifica.malha-poligonal@1"
            ]
          },
          "interfaces": {
            "entra": [],
            "sai": []
          },
          "requisitos": [],
          "custo": 1,
          "efeitos": [
            "cria-geometria"
          ],
          "identidade": "cria-por-passo",
          "uso": {
            "intencao": "Criar uma caixa retangular apoiada em y=0.",
            "schema": "mecanifica.argumentos.cubo@1",
            "obrigatorios": []
          }
        },
        {
          "id": "mecanifica.operacao.displace",
          "nome": "displace",
          "versao": "1.0.0",
          "categoria": "procedural",
          "artefatos": {
            "entra": [
              "mecanifica.malha-poligonal@1"
            ],
            "sai": [
              "mecanifica.malha-poligonal@1"
            ]
          },
          "interfaces": {
            "entra": [],
            "sai": []
          },
          "requisitos": [],
          "custo": 1,
          "efeitos": [
            "transforma-malha"
          ],
          "identidade": "preserva-ou-deriva",
          "uso": {
            "intencao": "Deslocar seleção ao longo das normais por ruído determinístico.",
            "schema": "mecanifica.argumentos.displace@1",
            "obrigatorios": []
          }
        },
        {
          "id": "mecanifica.operacao.encostar",
          "nome": "encostar",
          "versao": "1.0.0",
          "categoria": "procedural",
          "artefatos": {
            "entra": [
              "mecanifica.malha-poligonal@1"
            ],
            "sai": [
              "mecanifica.malha-poligonal@1"
            ]
          },
          "interfaces": {
            "entra": [],
            "sai": []
          },
          "requisitos": [],
          "custo": 1,
          "efeitos": [
            "transforma-malha"
          ],
          "identidade": "preserva-ou-deriva",
          "uso": {
            "intencao": "Posicionar uma seleção em contato direcional com uma referência.",
            "schema": "mecanifica.argumentos.encostar@1",
            "obrigatorios": [
              "sel",
              "referencia",
              "direcao"
            ]
          }
        },
        {
          "id": "mecanifica.operacao.esfera",
          "nome": "esfera",
          "versao": "1.0.0",
          "categoria": "procedural",
          "artefatos": {
            "entra": [],
            "sai": [
              "mecanifica.malha-poligonal@1"
            ]
          },
          "interfaces": {
            "entra": [],
            "sai": []
          },
          "requisitos": [],
          "custo": 1,
          "efeitos": [
            "cria-geometria"
          ],
          "identidade": "cria-por-passo",
          "uso": {
            "intencao": "Criar esfera UV apoiada no chão.",
            "schema": "mecanifica.argumentos.esfera@1",
            "obrigatorios": []
          }
        },
        {
          "id": "mecanifica.operacao.espelha",
          "nome": "espelha",
          "versao": "1.0.0",
          "categoria": "procedural",
          "artefatos": {
            "entra": [
              "mecanifica.malha-poligonal@1"
            ],
            "sai": [
              "mecanifica.malha-poligonal@1"
            ]
          },
          "interfaces": {
            "entra": [],
            "sai": []
          },
          "requisitos": [],
          "custo": 1,
          "efeitos": [
            "transforma-malha"
          ],
          "identidade": "preserva-ou-deriva",
          "uso": {
            "intencao": "Duplicar faces refletidas, com modo estrutural opcional.",
            "schema": "mecanifica.argumentos.espelha@1",
            "obrigatorios": [
              "eixo"
            ]
          }
        },
        {
          "id": "mecanifica.operacao.extruda",
          "nome": "extruda",
          "versao": "1.0.0",
          "categoria": "procedural",
          "artefatos": {
            "entra": [
              "mecanifica.malha-poligonal@1"
            ],
            "sai": [
              "mecanifica.malha-poligonal@1"
            ]
          },
          "interfaces": {
            "entra": [],
            "sai": []
          },
          "requisitos": [],
          "custo": 1,
          "efeitos": [
            "transforma-malha"
          ],
          "identidade": "preserva-ou-deriva",
          "uso": {
            "intencao": "Extrudar uma face por ID posicional.",
            "schema": "mecanifica.argumentos.extruda@1",